{
  "$schema": "https://json-schema.org/draft/2020-12/schema",
  "$id": "https://copenhagen.daily/contracts/editorial-spec.v1.schema.json",
  "title": "Editorial spec: the desk's compact decision, resolved into an edition contract by build",
  "type": "object",
  "additionalProperties": false,
  "required": ["edition", "stories"],
  "properties": {
    "bundle": {"type": "string", "description": "Block 1 bundle path; the run's window supplies it when absent."},
    "feeds": {"type": "string", "description": "Coverage inventory path; the run's feeds.json supplies it when absent."},
    "edition": {
      "type": "object",
      "additionalProperties": false,
      "required": ["id", "number", "name", "date", "cutoff_at", "checked_from", "input_id", "presentation", "note"],
      "properties": {
        "id": {"$ref": "#/$defs/id"},
        "number": {"type": "integer", "minimum": 1},
        "name": {"$ref": "#/$defs/text"},
        "date": {"type": "string", "pattern": "^\\d{4}-\\d{2}-\\d{2}$"},
        "cutoff_at": {"$ref": "#/$defs/timestamp"},
        "checked_from": {"$ref": "#/$defs/timestamp"},
        "generated_at": {"$ref": "#/$defs/timestamp"},
        "input_id": {"$ref": "#/$defs/id"},
        "presentation": {
          "type": "object",
          "additionalProperties": false,
          "properties": {
            "preferred_composition": {"enum": ["lead-wide", "lead-tall", "lead-centred"]},
            "emphasis": {"enum": ["one_big_story", "quiet_day", "many_stories"]},
            "ear_right": {"$ref": "#/$defs/text"}
          }
        },
        "note": {"$ref": "#/$defs/text"}
      }
    },
    "stories": {
      "type": "array",
      "minItems": 1,
      "maxItems": 64,
      "items": {"$ref": "#/$defs/story"}
    }
  },
  "$defs": {
    "id": {"type": "string", "pattern": "^[a-z0-9][a-z0-9_-]{0,79}$"},
    "text": {"type": "string", "minLength": 1, "maxLength": 20000, "pattern": "\\S"},
    "timestamp": {"type": "string", "pattern": "^\\d{4}-\\d{2}-\\d{2}T\\d{2}:\\d{2}:\\d{2}(\\.\\d{6})?Z$"},
    "source_ref": {
      "description": "A window number, or publisher:suffix where the suffix ends the article's source_id.",
      "oneOf": [
        {"type": "integer", "minimum": 1},
        {"type": "string", "pattern": "^[a-z0-9_]+:.+$"}
      ]
    },
    "paragraph": {
      "description": "[text, [publisher ids]]",
      "type": "array",
      "minItems": 2,
      "maxItems": 2,
      "prefixItems": [
        {"$ref": "#/$defs/text"},
        {"type": "array", "minItems": 0, "maxItems": 6, "uniqueItems": true, "items": {"$ref": "#/$defs/id"}}
      ],
      "items": false
    },
    "paragraphs": {"type": "array", "minItems": 1, "maxItems": 64, "items": {"$ref": "#/$defs/paragraph"}},
    "callout": {
      "oneOf": [
        {"type": "object", "additionalProperties": false, "required": ["kind", "text", "attribution", "attribution_source"],
         "properties": {"kind": {"const": "quote"}, "text": {"$ref": "#/$defs/text"}, "attribution": {"$ref": "#/$defs/text"}, "attribution_source": {"$ref": "#/$defs/id"}}},
        {"type": "object", "additionalProperties": false, "required": ["kind", "value", "label"],
         "properties": {"kind": {"const": "figure"}, "value": {"$ref": "#/$defs/text"}, "label": {"$ref": "#/$defs/text"}}},
        {"type": "object", "additionalProperties": false, "required": ["kind", "title", "items"],
         "properties": {"kind": {"const": "facts"}, "title": {"$ref": "#/$defs/text"}, "items": {"type": "array", "minItems": 2, "maxItems": 4, "items": {"$ref": "#/$defs/text"}}}},
        {"type": "object", "additionalProperties": false, "required": ["kind", "label", "text"],
         "properties": {"kind": {"const": "box"}, "label": {"$ref": "#/$defs/text"}, "text": {"$ref": "#/$defs/text"}}},
        {"type": "object", "additionalProperties": false, "required": ["kind", "title", "rows"],
         "properties": {"kind": {"const": "timeline"}, "title": {"$ref": "#/$defs/text"},
           "rows": {"type": "array", "minItems": 2, "maxItems": 4, "items": {"type": "object", "additionalProperties": false, "required": ["date", "text"],
             "properties": {"date": {"$ref": "#/$defs/text"}, "text": {"$ref": "#/$defs/text"}}}}}}
      ]
    },
    "story": {
      "type": "object",
      "additionalProperties": false,
      "required": ["id", "role", "kicker", "headline", "sources"],
      "properties": {
        "id": {"$ref": "#/$defs/id"},
        "role": {"enum": ["lead", "secondary", "brief"]},
        "device": {"enum": ["required", "optional", "reserve"], "description": "Inert: no run renders a device page. Defaults to required; kept so archived specs still build."},
        "fallback": {"type": "boolean", "description": "Inert, as device: a secondary that could live as a brief on a device page."},
        "kicker": {"$ref": "#/$defs/text"},
        "kicker_secondary": {"$ref": "#/$defs/text"},
        "headline": {"$ref": "#/$defs/text"},
        "headline_short": {"$ref": "#/$defs/text"},
        "deck": {"$ref": "#/$defs/text"},
        "lede": {"$ref": "#/$defs/paragraph"},
        "extended": {"$ref": "#/$defs/paragraphs"},
        "standard": {"$ref": "#/$defs/paragraphs"},
        "short": {"$ref": "#/$defs/paragraphs"},
        "callouts": {"type": "array", "maxItems": 16, "items": {"$ref": "#/$defs/callout"}},
        "sources": {"type": "array", "minItems": 1, "maxItems": 16, "uniqueItems": true, "items": {"$ref": "#/$defs/source_ref"}},
        "partial": {"type": "boolean", "description": "Copy rests on partial source coverage."}
      }
    }
  }
}
