{
  "bundle": "ingest/var/exports/eval/2026-09-15-morning",
  "feeds": "editorial/examples/2026-09-15-morning/feeds.json",
  "edition": {
    "id": "2026-09-15-morning",
    "number": 4,
    "name": "Morning edition",
    "date": "2026-09-15",
    "cutoff_at": "2026-09-15T08:00:00.000000Z",
    "checked_from": "2026-09-12T08:00:00.000000Z",
    "input_id": "export-2026-09-15-0800",
    "presentation": {
      "preferred_composition": "lead-centred",
      "emphasis": "many_stories",
      "ear_right": "Inside: Supreme Court blocks Trump on postal votes, Sweden's Centre Party says no, Widow's Bay sweeps the Emmys"
    },
    "note": "Built from headlines and RSS descriptions published between 10:00 on Saturday and 10:00 on Tuesday Copenhagen time, from 131 feeds at sixteen publishers, all polled successfully. Danish outlets decide what is news; international titles are linked where they cover the same story. Nothing else was read."
  },
  "stories": [
    {
      "id": "russian-frigate-flares-gedser",
      "role": "lead",
      "kicker": "Defence",
      "headline": "Russian frigate fires flares at Danish helicopter off Gedser",
      "headline_short": "Russia fires flares at Danish helicopter",
      "deck": "Ambassador summoned; Frederiksen says Moscow is testing NATO.",
      "extended": [
        [
          "A Russian frigate fired two flares at a Danish Fennec helicopter in international waters off Gedser on Monday, during what the Defence Command describes as routine photo documentation of the ship. The Foreign Ministry has summoned Russia's ambassador.",
          [
            "dr",
            "kristeligt_dagblad",
            "politiken"
          ]
        ],
        [
          "Defence minister Jeppe Bruus calls the situation serious. There had been no prior communication with the frigate as far as he knows.",
          [
            "berlingske",
            "dr"
          ]
        ],
        [
          "The incident is 'unfortunately not surprising', Mette Frederiksen said in a written statement on Tuesday. It shows Russia testing and challenging NATO, the behaviour of an 'aggressive and assertive Russia'.",
          [
            "kristeligt_dagblad",
            "dr"
          ]
        ],
        [
          "Politicians across the parties have united behind a joint message to Moscow, Jyllands-Posten reports from its live coverage, and foreign minister Lars Løkke Rasmussen responded on Tuesday morning.",
          [
            "jp"
          ]
        ],
        [
          "Both the frigate and the helicopter had every right to be where they were, Kristina Siig, professor of maritime law at Aalborg University, tells Ritzau.",
          [
            "kristeligt_dagblad"
          ]
        ],
        [
          "The Defence Ministry's statement landed at 23:02 on Monday night. Michael Jarlner, Politiken's international commentator, reads the affair as part of a new and risky pattern.",
          [
            "politiken"
          ]
        ]
      ],
      "standard": [
        [
          "A Russian frigate fired two flares at a Danish Fennec helicopter in international waters off Gedser on Monday, during what the Defence Command describes as routine photo documentation of the ship. The Foreign Ministry has summoned Russia's ambassador.",
          [
            "dr",
            "kristeligt_dagblad",
            "politiken"
          ]
        ],
        [
          "Defence minister Jeppe Bruus calls the situation serious. There had been no prior communication with the frigate as far as he knows.",
          [
            "berlingske",
            "dr"
          ]
        ],
        [
          "The incident is 'unfortunately not surprising', Mette Frederiksen said on Tuesday. It shows Russia testing and challenging NATO, the behaviour of an 'aggressive and assertive Russia'.",
          [
            "kristeligt_dagblad",
            "dr"
          ]
        ],
        [
          "Both the frigate and the helicopter had every right to be where they were, Kristina Siig, professor of maritime law at Aalborg University, tells Ritzau.",
          [
            "kristeligt_dagblad"
          ]
        ]
      ],
      "short": [
        [
          "A Russian frigate fired two flares at a Danish helicopter in international waters off Gedser on Monday. The Foreign Ministry has summoned Russia's ambassador, and Mette Frederiksen calls it the behaviour of an 'aggressive and assertive Russia'.",
          [
            "dr",
            "politiken",
            "kristeligt_dagblad"
          ]
        ]
      ],
      "callouts": [
        {
          "kind": "quote",
          "text": "Aggressive and assertive Russia.",
          "attribution": "Mette Frederiksen, prime minister",
          "attribution_source": "dr"
        },
        {
          "kind": "timeline",
          "title": "How it unfolded",
          "rows": [
            {
              "date": "Monday",
              "text": "Frigate fires two flares at the helicopter off Gedser"
            },
            {
              "date": "23:02",
              "text": "The Defence Ministry's statement lands"
            },
            {
              "date": "Overnight",
              "text": "Foreign Ministry summons Russia's ambassador"
            },
            {
              "date": "Tuesday",
              "text": "Frederiksen: 'unfortunately not surprising'"
            }
          ]
        }
      ],
      "sources": [
        "dr:c32aa14b-32bf-4745-87a6-4c2d9097ee2a",
        "dr:70ea5036-5747-4f3f-816a-2577c3b28ab1",
        "dr:acdcf4c9-b465-461e-9425-97f13f8fb9f7",
        "dr:3c41126d-b1f6-4938-ad9d-7a06b6b3de53",
        "politiken:10983068",
        "politiken:10983108",
        "berlingske:65695fe8-2020-5656-9fca-7013e28e8649",
        "berlingske:86906d6c-8f6f-501c-94b2-922e891d0f7d",
        "kristeligt_dagblad:c1b114fd-9919-4ece-a072-3b24772be6a3",
        "kristeligt_dagblad:0fbd4b2b-2d98-4e5a-9074-4b203938718a",
        "kristeligt_dagblad:619f810d-b829-4429-a0ee-4f35dec742fa",
        "tv2:ets-helikopter-beskudt-af-russisk-fregat",
        "jp:19642349",
        "jp:19642497",
        "jp:19642840",
        "borsen:pyroteknik-fra-russisk-fregat-ved-gedser"
      ]
    },
    {
      "id": "trump-energy-truce-claim",
      "role": "secondary",
      "kicker": "World",
      "headline": "Trump says Russia and Ukraine have agreed to stop hitting each other's energy sites",
      "headline_short": "Trump claims an energy truce",
      "deck": "Neither country has confirmed the deal.",
      "standard": [
        [
          "Ukraine and Russia have agreed not to attack each other's energy installations, Donald Trump wrote on Truth Social on Monday. Neither country has confirmed it.",
          [
            "kristeligt_dagblad",
            "berlingske",
            "borsen"
          ]
        ],
        [
          "TV 2's correspondent calls such a pause short-lived relief, 'like wetting your trousers' to keep warm.",
          [
            "tv2"
          ]
        ],
        [
          "Poland has warned of 'intensive actions' after Sunday's Russian drone strike on a passenger train a few kilometres from its border, which Ukrainians and Poles read as a new escalation.",
          [
            "dr"
          ]
        ]
      ],
      "short": [
        [
          "Ukraine and Russia have agreed not to attack each other's energy installations, Donald Trump wrote on Monday. Neither country has confirmed it.",
          [
            "kristeligt_dagblad",
            "berlingske"
          ]
        ]
      ],
      "sources": [
        "berlingske:0941a2fc-37ca-5ab5-ae24-e8b807224a03",
        "kristeligt_dagblad:cb632335-ac16-4795-9031-13a0ee75d31d",
        "borsen:-angribe-hinandens-energi-installationer",
        "tv2:erne-siger-korrespondent-om-angrebspause",
        "dr:af237534-bbe1-45ed-955b-bed6577f2e8b",
        "ft:d6f98d2e-9f0c-4414-a339-fe8462810276"
      ]
    },
    {
      "id": "supreme-court-mail-ballots",
      "role": "secondary",
      "kicker": "World",
      "headline": "Supreme Court blocks Trump's bid to restrict postal voting",
      "headline_short": "Supreme Court blocks Trump on postal votes",
      "deck": "States can post ballots as usual before the midterms, and the president's own appointees delivered the defeat.",
      "standard": [
        [
          "The US Supreme Court on Monday refused to let the postal service enforce stricter rules on mail-in ballots, so states can send ballots by post as normal ahead of the midterms.",
          [
            "kristeligt_dagblad",
            "borsen",
            "dr"
          ]
        ],
        [
          "Trump, a long-standing opponent of postal voting, had signed the order in late March. The justices he appointed helped deliver what Politiken calls a decisive defeat.",
          [
            "kristeligt_dagblad",
            "politiken"
          ]
        ]
      ],
      "short": [
        [
          "The US Supreme Court on Monday refused to let the postal service enforce stricter rules on mail-in ballots, so states can post ballots as normal before the midterms.",
          [
            "kristeligt_dagblad",
            "borsen"
          ]
        ]
      ],
      "sources": [
        "kristeligt_dagblad:be9d5793-320c-4893-bdf7-45a6bca3c268",
        "borsen:rump-i-sag-om-strammere-brevstemmeregler",
        "berlingske:0922ec52-f23a-536f-bee9-80563d08922b",
        "dr:91f20e45-43fc-4ec9-bd4d-acf4ca2b85d6",
        "politiken:10983072",
        "nytimes:ics/supreme-court-trump-mail-voting.html",
        "ft:b3674c9d-9db2-448d-bd57-f1c040de2d54",
        "wapo:l-ballot-restrictions-midterm-elections/",
        "guardian:e-court-rejects-mail-ballot-restrictions",
        "bbc:c5yjpdy4gjlo"
      ]
    },
    {
      "id": "ai-shares-slide-trump-conspiracy",
      "role": "secondary",